topicId,words..
0,financial market markets system banks credit crisis liquidity securities bank
1,growth prices economy year economic productivity current recent demand investment
2,inflation monetary central price economic bank term interest expectations prices
3,economic countries world trade economies international years economy technology capital
4,credit community mortgage loans small lending financial business loan housing
5,risk banks capital banking bank management financial regulatory basel risks
