full_date,speech_name,raw_spoke_to,vars.link,spoke_to,org_exist,place_1,place_2,name,position_cat,any_speech,bankersfinance,other_private,otherregulators,io,community_organisations,thinktank,press_association,prof_econ_assoc,university,hearing,trade_assoc,non_finance_gov,nonbuinessadvocacy,social_events,economic_literacy,other,org13-Jun-96,Bank supervision in a world economy,"At the International Conference of Banking Supervisors, Stockholm, Sweden",http://www.federalreserve.gov/boarddocs/speeches/1996/19960613.htm,International Conference of Banking Supervisors,, Stockholm, Sweden,Alan Greenspan,3,1,0,0,1,0,0,0,0,0,0,0,0,0,0,0,0,0,318-Jun-96,Developments in electronic money and banking,"At the CyberPayments '96 Conference, Dallas, Texas",http://www.federalreserve.gov/boarddocs/speeches/1996/19960618.htm,CyberPayments '96 Conference,, Dallas, Texas,Edward W. Kelley,1,1,1,0,0,0,0,0,0,0,0,0,0,0,0,0,0,0,108-Sep-96,Monetary policy objectives and strategy,"At the National Association of Business Economists 38th Annual Meeting, Boston, Massachusetts",http://www.federalreserve.gov/boarddocs/speeches/1996/19960908.htm,National Association of Business Economists 38th Annual Meeting,, Boston, Massachusetts,Laurence H. Meyer,1,1,0,0,0,0,0,0,0,1,0,0,0,0,0,0,0,0,819-Sep-96,Regulation and electronic payment systems,"At the U.S. Treasury Conference on Electronic Money & Banking: The Role of Government, Washington, D.C.",http://www.federalreserve.gov/boarddocs/speeches/1996/19960919.htm,U.S. Treasury Conference on Electronic Money & Banking: The Role of Government,, Washington, D.C.,Alan Greenspan,3,1,0,0,1,0,0,0,0,0,0,0,0,0,0,0,0,0,302-Oct-96,Small business is big business,"At the Small Business Development Conference, Richmond, Virginia",http://www.federalreserve.gov/boarddocs/speeches/1996/19961002.htm,Small Business Development Conference,, Richmond, Virginia,Lawrence B. Lindsey,1,1,0,1,0,0,0,0,0,0,0,0,0,0,0,0,0,0,205-Oct-96,"Bank supervision, regulation, and risk","At the Annual Convention of the American Bankers Association, Honolulu, Hawaii",http://www.federalreserve.gov/boarddocs/speeches/1996/19961005.htm,Annual Convention of the American Bankers Association,, Honolulu, Hawaii,Alan Greenspan,3,1,1,0,0,0,0,0,0,0,0,0,0,0,0,0,0,0,107-Oct-96,U.S. Treasury securities market: Lessons from Alexander Hamilton,"At the Annual Public Service Awards Dinner of the Public Securities Association, New York, New York",http://www.federalreserve.gov/boarddocs/speeches/1996/19961007.htm,Annual Public Service Awards Dinner of the Public Securities Association,, New York, New York,Alan Greenspan,3,1,1,0,0,0,0,0,0,0,0,0,0,0,0,0,0,0,109-Oct-96,Here we go again?,"At the Community Development Lending Conference, Dallas, Texas",http://www.federalreserve.gov/boarddocs/speeches/1996/19961009.htm,Community Development Lending Conference,, Dallas, Texas,Lawrence B. Lindsey,1,1,0,0,0,0,1,0,0,0,0,0,0,0,0,0,0,0,511-Oct-96,How to grow faster,"At the Atlantic Economic Society, Washington, D.C.",http://www.federalreserve.gov/boarddocs/speeches/1996/19961011.htm,Atlantic Economic Society,, Washington, D.C.,Lawrence B. Lindsey,1,1,0,0,0,0,0,0,0,1,0,0,0,0,0,0,0,0,816-Oct-96,Technological advances and productivity,"At the 80th Anniversary Awards Dinner of The Conference Board, New York, New York",http://www.federalreserve.gov/boarddocs/speeches/1996/19961016.htm,80th Anniversary Awards Dinner of The Conference Board,, New York, New York,Alan Greenspan,3,1,0,1,0,0,0,0,0,0,0,0,0,0,0,0,0,0,224-Oct-96,Accounting and auditing standards and bank supervision,"At the 23rd Annual Accounting Lecture Series of the University of Tennessee, Chattanooga, Tennessee",http://www.federalreserve.gov/boarddocs/speeches/1996/19961024.htm,23rd Annual Accounting Lecture Series of the University of Tennessee,, Chattanooga, Tennessee,Susan M. Phillips,1,1,0,0,0,0,0,0,0,0,1,0,0,0,0,0,0,0,931-Oct-96,The future of electronic payments,"At the BAI Money Transfer '96 Conference, New York, New York",http://www.federalreserve.gov/boarddocs/speeches/1996/19961031.htm,BAI Money Transfer '96 Conference,, New York, New York,Edward W. Kelley,1,1,0,0,1,0,0,0,0,0,0,0,0,0,0,0,0,0,318-Nov-96,Banking in the global marketplace,"At the Federation of Bankers Associations of Japan, Tokyo, Japan",http://www.federalreserve.gov/boarddocs/speeches/1996/19961118.htm,Federation of Bankers Associations of Japan,, Tokyo, Japan,Alan Greenspan,3,1,1,0,0,0,0,0,0,0,0,0,0,0,0,0,0,0,121-Nov-96,The transformation of the U.S. banking industry and resulting challenges to regulators,"At the Ohio Bankers Day Convention, Columbus, Ohio",http://www.federalreserve.gov/boarddocs/speeches/1996/19961121.htm,Ohio Bankers Day Convention,, Columbus, Ohio,Laurence H. Meyer,1,1,1,0,0,0,0,0,0,0,0,0,0,0,0,0,0,0,125-Nov-96,Supervisory and regulatory responses to financial innovation and industry dynamics,"At the BAI Seminar on Regulatory Policy Changes, Washington, D.C.",http://www.federalreserve.gov/boarddocs/speeches/1996/19961125.htm,BAI Seminar on Regulatory Policy Changes,, Washington, D.C.,Susan M. Phillips,1,1,0,0,1,0,0,0,0,0,0,0,0,0,0,0,0,0,303-Dec-96,Clearinghouses and risk management,"At the 1996 Payments System Risk Conference, Washington, D.C.",http://www.federalreserve.gov/boarddocs/speeches/1996/19961203.htm,1996 Payments System Risk Conference,, Washington, D.C.,Edward W. Kelley,1,1,1,0,0,0,0,0,0,0,0,0,0,0,0,0,0,0,105-Dec-96,The challenge of central banking in a democratic society,"At the Annual Dinner and Francis Boyer Lecture of The American Enterprise Institute for Public Policy Research, Washington, D.C.",http://www.federalreserve.gov/boarddocs/speeches/1996/19961205.htm,Annual Dinner and Francis Boyer Lecture of The American Enterprise Institute for Public Policy R,,,,Alan Greenspan,3,1,0,0,0,0,0,1,0,0,0,0,0,0,0,0,0,0,606-Dec-96,Social security,"At the Abraham Lincoln Award Ceremony of the Union League of Philadelphia, Philadelphia, Pennsylvania",http://www.federalreserve.gov/boarddocs/speeches/1996/19961206.htm,Abraham Lincoln Award Ceremony of the Union League of Philadelphia,, Philadelphia, Pennsylvania,Alan Greenspan,3,1,0,0,0,0,0,0,0,0,0,0,0,0,0,1,0,0,1419-Dec-96,Supervision of bank risk-taking,"At the The Brookings Institution National Issues Forum, Washington, D.C.",http://www.federalreserve.gov/boarddocs/speeches/1996/19961219.htm,The Brookings Institution National Issues Forum,, Washington, D.C.,Alice M. Rivlin,2,1,0,0,0,0,0,1,0,0,0,0,0,0,0,0,0,0,605-Jan-97,The role of structural macroeconomic models,"At the AEA Panel on Monetary and Fiscal Policy, New Orleans, Louisiana",http://www.federalreserve.gov/boarddocs/speeches/1997/19970105.htm,AEA Panel on Monetary and Fiscal Policy,, New Orleans, Louisiana,Laurence H. Meyer,1,1,0,0,0,0,0,0,0,1,0,0,0,0,0,0,0,0,814-Jan-97,Central banking and global finance,"At the Catholic University Leuven, Leuven, Belgium",http://www.federalreserve.gov/boarddocs/speeches/1997/19970114.htm,Catholic University Leuven,, Leuven, Belgium,Alan Greenspan,3,1,0,0,0,0,0,0,0,0,1,0,0,0,0,0,0,0,916-Jan-97,The economic outlook and challenges for monetary policy,"At the Charlotte Economics Club, Charlotte, North Carolina",http://www.federalreserve.gov/boarddocs/speeches/1997/19970116.htm,Charlotte Economics Club,, Charlotte, North Carolina,Laurence H. Meyer,1,1,0,0,0,0,0,0,0,1,0,0,0,0,0,0,0,0,824-Jan-97,Financial modernization: Rationalizing the structure of the financial services industry,"At the 99th Assembly for Bank Directors, Southwestern Graduate School of Banking, Westin Regina Resort, Puerto Vallarta, Mexico",http://www.federalreserve.gov/boarddocs/speeches/1997/19970124.htm,99th Assembly for Bank Directors,, Southwestern Graduate School of Banking, Westin Regina Resort,Laurence H. Meyer,1,1,0,0,0,0,0,0,0,0,1,0,0,0,0,0,0,0,928-Jan-97,International competition: Should we harmonize our national regulatory systems?,"At the Seminar on Banking Soundness and Monetary Policy in a World of Global Capital Markets,Sponsored by the International Monetary Fund, Washington, D.C.",http://www.federalreserve.gov/boarddocs/speeches/1997/19970128.htm,Seminar on Banking Soundness and Monetary Policy in a World of Global Capital Markets,,Sponsored,,Susan M. Phillips,1,1,1,0,0,0,0,0,0,0,0,0,0,0,0,0,0,0,129-Jan-97,Are banks still special?,"At the Seminar on Banking Soundness and Monetary Policy in a World of Global Capital Markets, Sponsored by the International Monetary Fund, Washington, D.C.",http://www.federalreserve.gov/boarddocs/speeches/1997/19970129.htm,Seminar on Banking Soundness and Monetary Policy in a World of Global Capital Markets,, Sponsored,,Edward W. Kelley,1,1,1,0,0,0,0,0,0,0,0,0,0,0,0,0,0,0,114-Feb-97,Risk management for banks and banking regulators in the 21st century,"At the Atlanta Society of Financial Analysis, Atlanta, Georgia",http://www.federalreserve.gov/boarddocs/speeches/1997/19970214.htm,Atlanta Society of Financial Analysis,, Atlanta, Georgia,Susan M. Phillips,1,1,1,0,0,0,0,0,0,0,0,0,0,0,0,0,0,0,121-Feb-97,Government regulation and derivative contracts,"At the Financial Markets Conference of the Federal Reserve Bank of Atlanta, Coral Gables, Florida",http://www.federalreserve.gov/boarddocs/speeches/1997/19970221.htm,Financial Markets Conference of the Federal Reserve Bank of Atlanta,, Coral Gables, Florida,Alan Greenspan,3,1,0,0,1,0,0,0,0,0,0,0,0,0,0,0,0,0,303-Mar-97,Recent developments in supervision and regulation and how they affect the debate on financial modernization,At the Annual Washington Conference of the Institute of International Bankers,http://www.federalreserve.gov/boarddocs/speeches/1997/19970303.htm,Annual Washington Conference of the Institute of International Bankers,,,,Susan M. Phillips,1,1,1,0,0,0,0,0,0,0,0,0,0,0,0,0,0,0,107-Mar-97,Privacy in the information age,"At the Conference on Privacy in the Information Age, Salt Lake City, Utah",http://www.federalreserve.gov/boarddocs/speeches/1997/19970307.htm,Conference on Privacy in the Information Age,, Salt Lake City, Utah,Alan Greenspan,3,1,0,0,0,0,0,0,0,0,0,0,0,0,0,0,0,1,1613-Mar-97,Sustaining CRA's success,"At the Annual Meeting of the National Community Reinvestment Coalition, Washington, D.C.",http://www.federalreserve.gov/boarddocs/speeches/1997/19970313.htm,Annual Meeting of the National Community Reinvestment Coalition,, Washington, D.C.,Alice M. Rivlin,2,1,0,0,0,0,1,0,0,0,0,0,0,0,0,0,0,0,522-Mar-97,Financial reform and the importance of a decentralized banking structure,"At the Annual Convention of the Independent Bankers Association of America, Phoenix, Arizona",http://www.federalreserve.gov/boarddocs/speeches/1997/19970322.htm,Annual Convention of the Independent Bankers Association of America,, Phoenix, Arizona,Alan Greenspan,3,1,1,0,0,0,0,0,0,0,0,0,0,0,0,0,0,0,104-Apr-97,The challenges of macroeconomic policy,"At the Annual Meeting of the Eastern Economic Association, Washington, D.C.",http://www.federalreserve.gov/boarddocs/speeches/1997/19970404.htm,Annual Meeting of the Eastern Economic Association,, Washington, D.C.,Alice M. Rivlin,2,1,0,0,0,0,0,0,0,1,0,0,0,0,0,0,0,0,810-Apr-97,Issues in financial modernization,"At the Seventh Annual Conference on Financial Structure, Annandale-on-Hudson, New York",http://www.federalreserve.gov/boarddocs/speeches/1997/19970410.htm,Seventh Annual Conference on Financial Structure,, Annandale-on-Hudson, New York,Laurence H. Meyer,1,1,1,0,0,0,0,0,0,0,0,0,0,0,0,0,0,0,112-Apr-97,The evolution of banking in a market economy,"At the Annual Conference of the Association of Private Enterprise Education, Arlington, Virginia",http://www.federalreserve.gov/boarddocs/speeches/1997/19970412.htm,Annual Conference of the Association of Private Enterprise Education,, Arlington, Virginia,Alan Greenspan,3,1,0,0,0,0,0,0,0,0,0,0,0,0,0,0,1,0,1524-Apr-97,The economic outlook and challenges facing monetary policy,"At the Forecasters Club of New York, New York, New York",http://www.federalreserve.gov/boarddocs/speeches/1997/19970424.htm,Forecasters Club of New York,, New York, New York,Laurence H. Meyer,1,1,0,0,0,0,0,0,0,1,0,0,0,0,0,0,0,0,829-Apr-97,G-7 economic summit meeting,"At the Spring Meeting of the Institute of International Finance, Washington, D.C.",http://www.federalreserve.gov/boarddocs/speeches/1997/19970429.htm,Spring Meeting of the Institute of International Finance,, Washington, D.C.,Alan Greenspan,3,1,1,0,0,0,0,0,0,0,0,0,0,0,0,0,0,0,101-May-97,Technological change and the design of bank supervisory policies,"At the Conference on Bank Structure and Competition of the Federal Reserve Bank of Chicago, Chicago, Illinois",http://www.federalreserve.gov/boarddocs/speeches/1997/19970501.htm,Conference on Bank Structure and Competition of the Federal Reserve Bank of Chicago,, Chicago, Il,Alan Greenspan,3,1,0,0,1,0,0,0,0,0,0,0,0,0,0,0,0,0,303-May-97,Financial reform and importance of the state charter,"At the Annual Meeting and Conference of the Conference of State Bank Supervisors, San Diego, California",http://www.federalreserve.gov/boarddocs/speeches/1997/19970503.htm,Annual Meeting and Conference of the Conference of State Bank Supervisors,, San Diego, California,Alan Greenspan,3,1,0,0,1,0,0,0,0,0,0,0,0,0,0,0,0,0,308-May-97,Current monetary policy,"At the 1997 Haskins Partners Dinner of the Stern School of Business, New York University, New York, New York",http://www.federalreserve.gov/boarddocs/speeches/1997/19970508.htm,1997 Haskins Partners Dinner of the Stern School of Business,, New York University, New York,Alan Greenspan,3,1,0,0,0,0,0,0,0,0,1,0,0,0,0,0,0,0,923-May-97,The role of banks in small business finance,"At the Conference on Small Business Finance, New York, New York",http://www.federalreserve.gov/boarddocs/speeches/1997/19970523.htm,Conference on Small Business Finance,, New York, New York,Laurence H. Meyer,1,1,1,0,0,0,0,0,0,0,0,0,0,0,0,0,0,0,110-Jun-97,The embrace of free markets,"At the Woodrow Wilson Award Dinner of the Woodrow Wilson International Center for Scholars, New York, New York",http://www.federalreserve.gov/boarddocs/speeches/1997/19970610.htm,Woodrow Wilson Award Dinner of the Woodrow Wilson International Center for Scholars,, New York, N,Alan Greenspan,3,1,0,0,0,0,0,0,0,0,1,0,0,0,0,0,0,0,918-Jun-97,Models for neighborhood development and reinvestment,At the Annual Meeting on Neighborhood Housing Services of New York City,http://www.federalreserve.gov/boarddocs/speeches/1997/199706182.htm,Annual Meeting on Neighborhood Housing Services of New York City,,,,Laurence H. Meyer,1,1,0,0,0,0,1,0,0,0,0,0,0,0,0,0,0,0,518-Jun-97,The changing financial landscape and umbrella supervision,"At the Exchequer Club, Washington, D.C.",http://www.federalreserve.gov/boarddocs/speeches/1997/19970618.htm,Exchequer Club,, Washington, D.C.,Susan M. Phillips,1,1,0,0,0,0,0,0,0,1,0,0,0,0,0,0,0,0,804-Sep-97,Affordable housing,"Before the National Association of Affordable Housing Lenders̥ 1997 Northeast Regional Conference, Boston, Massachusetts",http://www.federalreserve.gov/boarddocs/speeches/1997/19970904.htm,the National Association of Affordable Housing Lenders̥ 1997 Northeast Regional Conference,, Bos,,Laurence H. Meyer,1,1,0,0,0,0,0,0,0,0,0,0,0,0,1,0,0,0,1305-Sep-97,Rules vs. discretionary monetary policy,"At the 15th Anniversary Conference of the Center for Economic Policy Research at Stanford University, Stanford, California",http://www.federalreserve.gov/boarddocs/speeches/1997/19970905.htm,15th Anniversary Conference of the Center for Economic Policy Research at Stanford University,, S,,Alan Greenspan,3,1,0,0,0,0,0,0,0,0,1,0,0,0,0,0,0,0,912-Sep-97,"Education, technology, and economic growth","At the Building Dedication Ceremonies at the Kenan-Flagler Business School, University of North Carolina, Chapel Hill, North Carolina",http://www.federalreserve.gov/boarddocs/speeches/1997/19970912.htm,Building Dedication Ceremonies at the Kenan-Flagler Business School,, University of North Carolin,,Alan Greenspan,3,1,0,0,0,0,0,0,0,0,1,0,0,0,0,0,0,0,912-Sep-97,Monetary policy and the bond market: Complements or substitutes,"Before the Fixed Income Summit of PSA The Bond Market Trade Association, Washington, D.C.",http://www.federalreserve.gov/boarddocs/speeches/1997/199709122.htm,the Fixed Income Summit of PSA The Bond Market Trade Association,, Washington, D.C.,Laurence H. Meyer,1,1,1,0,0,0,0,0,0,0,0,0,0,0,0,0,0,0,117-Sep-97,The economic outlook and challenges facing monetary policy,"Before the 1998 Global Economic and Investment Outlook Conference, Carnegie Mellon University, Pittsburgh, Pennsylvania",http://www.federalreserve.gov/boarddocs/speeches/1997/19970917.htm,the 1998 Global Economic and Investment Outlook Conference,, Carnegie Mellon University, Pittsbur,Laurence H. Meyer,1,1,0,0,0,0,0,0,0,0,1,0,0,0,0,0,0,0,919-Sep-97,Derivatives and risk management,"At the Derivatives & Risk Management Symposium of the Fordham University School of Law, New York, New York",http://www.federalreserve.gov/boarddocs/speeches/1997/19970919.htm,Derivatives & Risk Management Symposium of the Fordham University School of Law,, New York, New Y,Susan M. Phillips,1,1,0,0,0,0,0,0,0,0,1,0,0,0,0,0,0,0,923-Sep-97,The role of the Federal Reserve in the payments system,"Before the Bank Administration Institute's Symposium on Payments System Strategy, Washington, D.C.",http://www.federalreserve.gov/boarddocs/speeches/1997/19970923.htm,the Bank Administration Institute's Symposium on Payments System Strategy,, Washington, D.C.,Edward W. Kelley,1,1,0,0,0,0,0,1,0,0,0,0,0,0,0,0,0,0,605-Oct-97,Technological change and the economy,"At the Annual Convention of the American Bankers Association, Boston, Massachusetts",http://www.federalreserve.gov/boarddocs/speeches/1997/19971005.htm,Annual Convention of the American Bankers Association,, Boston, Massachusetts,Alan Greenspan,3,1,1,0,0,0,0,0,0,0,0,0,0,0,0,0,0,0,111-Oct-97,Consumer credit and financial modernization,"At the Economic Development Conference of the Greenlining Institute, San Francisco, California",http://www.federalreserve.gov/boarddocs/speeches/1997/19971011.htm,Economic Development Conference of the Greenlining Institute,, San Francisco, California,Alan Greenspan,3,1,0,0,0,0,0,1,0,0,0,0,0,0,0,0,0,0,614-Oct-97,Globalization of finance,"At the 15th Annual Monetary Conference of the Cato Institute, Washington, D.C.",http://www.federalreserve.gov/boarddocs/speeches/1997/19971014.htm,15th Annual Monetary Conference of the Cato Institute,, Washington, D.C.,Alan Greenspan,3,1,0,0,0,0,0,1,0,0,0,0,0,0,0,0,0,0,614-Oct-97,Inaugural speech for economic seminar series,"At the University of Connecticut, Storrs, Connecticut",http://www.federalreserve.gov/boarddocs/speeches/1997/199710142.htm,University of Connecticut,, Storrs, Connecticut,Alan Greenspan,3,1,0,0,0,0,0,0,0,0,1,0,0,0,0,0,0,0,914-Oct-97,Globalization and U.S. monetary policy,"Before the Institute for Global Management and Research School of Business and Public Management, The George Washington University, Washington, D.C.",http://www.federalreserve.gov/boarddocs/speeches/1997/199710143.htm,the Institute for Global Management and Research School of Business and Public Management,, The G,,Laurence H. Meyer,1,1,0,0,0,0,0,0,0,0,1,0,0,0,0,0,0,0,915-Oct-97,Black Monday: 10 years later,"At a program of the Financial Women's Association, Bentley College, Waltham, Massachusetts",http://www.federalreserve.gov/boarddocs/speeches/1997/19971015.htm,rogram of the Financial Women's Association,, Bentley College, Waltham,Susan M. Phillips,1,1,0,0,0,0,0,0,0,0,0,0,0,0,1,0,0,0,1330-Oct-97,Trends and challenges in Federal Reserve bank supervision,"At Houston Baptist University, Houston, Texas",http://www.federalreserve.gov/boarddocs/speeches/1997/19971030.htm,ston Baptist University,, Houston, Texas,Susan M. Phillips,1,1,0,0,0,0,0,0,0,0,1,0,0,0,0,0,0,0,931-Oct-97,Community development: Changes and challenges,"Before the Federal Reserve Bank of Chicago Biannual Community Development Conference, Chicago, Illinois",http://www.federalreserve.gov/boarddocs/speeches/1997/19971031.htm,the Federal Reserve Bank of Chicago Biannual Community Development Conference,, Chicago, Illinois,Laurence H. Meyer,1,1,0,0,0,0,1,0,0,0,0,0,0,0,0,0,0,0,504-Nov-97,Risk management,"At the Asset/Liability and Treasury Management Conference of the Bank Administration Institute, Chicago, Illinois",http://www.federalreserve.gov/boarddocs/speeches/1997/19971104.htm,Asset/Liability and Treasury Management Conference of the Bank Administration Institute,, Chicago,,Susan M. Phillips,1,1,0,0,0,0,0,1,0,0,0,0,0,0,0,0,0,0,607-Nov-97,Price measurement,"At the Center for Financial Studies Frankfurt, Germany",http://www.federalreserve.gov/boarddocs/speeches/1997/19971107.htm,Center for Financial Studies Frankfurt,, Germany,,Alan Greenspan,3,1,0,0,0,0,0,1,0,0,0,0,0,0,0,0,0,0,601-Dec-97,New approaches to small business development partnerships,"At the University of Wisconsin-Milwaukee, Urban Studies Programs, Milwaukee, Wisconsin",http://www.federalreserve.gov/boarddocs/speeches/1997/19971201.htm,University of Wisconsin-Milwaukee,, Urban Studies Programs, Milwaukee,Laurence H. Meyer,1,1,0,0,0,0,0,0,0,0,1,0,0,0,0,0,0,0,902-Dec-97,Growth and flexibility: Lessons from Asia,"At The Economic Club of New York, New York, N.Y.",http://www.federalreserve.gov/boarddocs/speeches/1997/19971202.htm,Economic Club of New York,, New York, N.Y.,Alan Greenspan,3,1,0,0,0,0,0,0,0,1,0,0,0,0,0,0,0,0,803-Dec-97,The role of education during rapid economic change,"At Syracuse University, Syracuse, New York",http://www.federalreserve.gov/boarddocs/speeches/1997/19971203.htm,acuse University,, Syracuse, New York,Alan Greenspan,3,1,0,0,0,0,0,0,0,0,1,0,0,0,0,0,0,0,915-Dec-97,"The ""Millennium Bug""","Before the Professional Banker's Association, Washington, D.C.",http://www.federalreserve.gov/boarddocs/speeches/1997/19971215.htm,the Professional Banker's Association,, Washington, D.C.,Edward W. Kelley,1,1,1,0,0,0,0,0,0,0,0,0,0,0,0,0,0,0,103-Jan-98,Problems of price measurement,"At the Annual Meeting of the American Economic Association and the American Finance Association, Chicago, Illinois",http://www.federalreserve.gov/boarddocs/speeches/1998/19980103.htm,Annual Meeting of the American Economic Association and the American Finance Association,, Chicag,,Alan Greenspan,3,1,1,0,0,0,0,0,0,1,0,0,0,0,0,0,0,0,808-Jan-98,The economic outlook and challenges facing monetary policy,"Before the Economic Strategy Institute, Washington, D.C.",http://www.federalreserve.gov/boarddocs/speeches/1998/19980108.htm,the Economic Strategy Institute,, Washington, D.C.,Laurence H. Meyer,1,1,0,0,0,0,0,1,0,0,0,0,0,0,0,0,0,0,612-Jan-98,Economic development in low- and moderate-income communities,"At a Community Forum on Community Reinvestment and Access to Credit: California's Challenge, Los Angeles, California",http://www.federalreserve.gov/boarddocs/speeches/1998/19980112.htm,ommunity Forum on Community Reinvestment and Access to Credit: California's Challenge,, Los Angele,,Alan Greenspan,3,1,0,0,0,0,1,0,0,0,0,0,0,0,0,0,0,0,516-Jan-98,The underemployment of minorities,"At the Wall Street Project Anniversary Conference of the Rainbow/PUSH Coalition, New York, New York",http://www.federalreserve.gov/boarddocs/speeches/1998/19980116.htm,Wall Street Project Anniversary Conference of the Rainbow/PUSH Coalition,, New York, New York,Alan Greenspan,3,1,1,0,0,0,0,0,0,0,0,0,0,0,0,0,0,0,111-Feb-98,Year 2000: a worldwide concern ,"Before the Florida International Bankers Association and the Miami Bond Club, Miami, Florida",http://www.federalreserve.gov/boarddocs/speeches/1998/19980211.htm,the Florida International Bankers Association and the Miami Bond Club,, Miami, Florida,Edward W. Kelley,1,1,1,0,0,0,0,0,0,0,0,0,0,0,0,0,0,0,117-Feb-98,Does good policy analysis matter?,"Before the Dedication of The Alice Mitchell Rivlin Conference Room, Office of the Assistant Secretary for Planning and Evaluation (ASPE), Department of Health and Human Services, Washington, D.C.",http://www.federalreserve.gov/boarddocs/speeches/1998/19980217.htm,the Dedication of The Alice Mitchell Rivlin Conference Room,, Office of the Assistant Secretary f,,Alice M. Rivlin,2,1,0,0,0,0,0,0,0,0,0,0,0,1,0,0,0,0,1226-Feb-98,The role of capital in optimal banking supervision and regulation,"Before the Conference on Capital Regulation in the 21st Century, Federal Reserve Bank of New York, New York, NY",http://www.federalreserve.gov/boarddocs/speeches/1998/19980226.htm,the Conference on Capital Regulation in the 21st Century,, Federal Reserve Bank of New York, New,Alan Greenspan,3,1,0,0,1,0,0,0,0,0,0,0,0,0,0,0,0,0,327-Feb-98,Risk management in the global financial system,"Before the Annual Financial Markets Conference of the Federal Reserve Bank of Atlanta, Miami Beach, Florida",http://www.federalreserve.gov/boarddocs/speeches/1998/19980227.htm,the Annual Financial Markets Conference of the Federal Reserve Bank of Atlanta,, Miami Beach, Flo,Alan Greenspan,3,1,0,0,1,0,0,0,0,0,0,0,0,0,0,0,0,0,327-Feb-98,Monetary rules,"The Samuelson Lecture, before the 24th Annual Conference of the Eastern Economic Association, New York, New York",http://www.federalreserve.gov/boarddocs/speeches/1998/199802272.htm,muelson Lecture,, before the 24th Annual Conference of the Eastern Economic Association, New York,Edward M. Gramlich,1,1,0,0,0,0,0,0,0,1,0,0,0,0,0,0,0,0,802-Mar-98,Financial globalization and efficient banking regulation,"Before the Annual Washington Conference of the Institute of International Bankers, Washington, D.C.",http://www.federalreserve.gov/boarddocs/speeches/1998/19980302.htm,the Annual Washington Conference of the Institute of International Bankers,, Washington, D.C.,Laurence H. Meyer,1,1,0,0,0,0,0,1,0,0,0,0,0,0,0,0,0,0,6