full_date,speech_name,raw_spoke_to,vars.link,spoke_to,org_exist,place_1,place_2,name,position_cat,any_speech,bankersfinance,other_private,otherregulators,io,community_organisations,thinktank,press_association,prof_econ_assoc,university,hearing,trade_assoc,non_finance_gov,nonbuinessadvocacy,social_events,economic_literacy,other,org13-Nov-07,Implementing Basel II in the United States,"At the Standard & Poor's Bank Conference 2007, New York, New York",http://www.federalreserve.gov/newsevents/speech/kroszner20071113a.htm,Standard & Poor's Bank Conference 2007,, New York, New York,Randall S. Kroszner,1,1,1,0,0,0,0,0,0,0,0,0,0,0,0,0,0,0,114-Nov-07,Federal Reserve Communications,"At the Cato Institute 25th Annual Monetary Conference, Washington, D.C.",http://www.federalreserve.gov/newsevents/speech/bernanke20071114a.htm,Cato Institute 25th Annual Monetary Conference,, Washington, D.C.,Ben S. Bernanke,3,1,0,0,0,0,0,1,0,0,0,0,0,0,0,0,0,0,616-Nov-07,Risk Management and the Economic Outlook,"At the Conference on Competitive Markets and Effective Regulation, Institute of International Finance, New York, New York",http://www.federalreserve.gov/newsevents/speech/kroszner2007116a.htm,Conference on Competitive Markets and Effective Regulation,, Institute of International Finance,,Randall S. Kroszner,1,1,1,0,0,0,0,0,0,0,0,0,0,0,0,0,0,0,128-Nov-07,Financial Markets and Central Banking,"C. Peter McColough Series on International Economics, Council on Foreign Relations, New York, New York",http://www.federalreserve.gov/newsevents/speech/kohn20071128a.htm,er McColough Series on International Economics,, Council on Foreign Relations, New York,Donald L. Kohn,2,1,0,0,0,0,0,1,0,0,0,0,0,0,0,0,0,0,629-Nov-07,National and regional economic overview,"At the presentation of the Citizen of the Carolinas Award, Charlotte Chamber of Commerce, Charlotte, North Carolina",http://www.federalreserve.gov/newsevents/speech/bernanke20071129a.htm,presentation of the Citizen of the Carolinas Award,, Charlotte Chamber of Commerce, Charlotte,Ben S. Bernanke,3,1,0,1,0,0,0,0,0,0,0,0,0,0,0,0,0,0,229-Nov-07,The Federal Reserve̥s Enhanced Communication Strategy and the Science of Monetary Policy,"To the Undergraduate Economics Association, Massachusetts Institute of Technology, Cambridge, Massachusetts",http://www.federalreserve.gov/newsevents/speech/mishkin20071129a.htm,Undergraduate Economics Association,, Massachusetts Institute of Technology, Cambridge,Frederic S. Mishkin,1,1,0,0,0,0,0,0,0,0,1,0,0,0,0,0,0,0,930-Nov-07,"Innovation, Information, and Regulation in Financial Markets","At the Philadelphia Fed Policy Forum, Philadelphia, Pennsylvania",http://www.federalreserve.gov/newsevents/speech/kroszner20071130a.htm,Philadelphia Fed Policy Forum,, Philadelphia, Pennsylvania,Randall S. Kroszner,1,1,0,0,1,0,0,0,0,0,0,0,0,0,0,0,0,0,304-Jan-08,"Expertise and Macroeconomic Policy, Comments on ""Insiders versus Outsiders in Monetary Policy-Making,"" by Timothy Besley, Neil Meads, and Paolo Surico","At the American Economic Association Session, Allied Social Science Associations Annual Meeting, New Orleans, Louisiana",http://www.federalreserve.gov/newsevents/speech/kohn20080104a.htm,American Economic Association Session,, Allied Social Science Associations Annual Meeting, New Or,Donald L. Kohn,2,1,0,0,0,0,0,0,0,1,0,0,0,0,0,0,0,0,805-Jan-08,Recent and Prospective Developments in Monetary Policy Transparency and Communications: A Global Perspective,"At the National Association for Business Economics Session, Allied Social Science Associations Annual Meeting, New Orleans, Louisiana",http://www.federalreserve.gov/newsevents/speech/kohn20080105a.htm,National Association for Business Economics Session,, Allied Social Science Associations Annual M,,Donald L. Kohn,2,1,0,0,0,0,0,0,0,1,0,0,0,0,0,0,0,0,810-Jan-08,"Financial Markets, the Economic Outlook, and Monetary Policy","At the Women in Housing and Finance and Exchequer Club Joint Luncheon, Washington, D.C.",http://www.federalreserve.gov/newsevents/speech/bernanke20080110a.htm,Women in Housing and Finance and Exchequer Club Joint Luncheon,, Washington, D.C.,Ben S. Bernanke,3,1,0,0,0,0,0,0,0,1,0,0,0,0,1,0,0,0,1311-Jan-08,"Monetary Policy Flexibility, Risk Management, and Financial Disruptions","At the Federal Reserve Bank of New York, New York, New York",http://www.federalreserve.gov/newsevents/speech/mishkin20080111a.htm,Federal Reserve Bank of New York,, New York, New York,Frederic S. Mishkin,1,1,0,0,1,0,0,0,0,0,0,0,0,0,0,0,0,0,304-Feb-08,Protecting Homeowners and Sustaining Home Ownership,"At the American Securitization Forum 2008 Conference, Las Vegas, Nevada, Governor Kroszner presented identical remarks at the Women in Housing and Finance Subprime Symposium, Washington, D.C., on February 6, 2008",http://www.federalreserve.gov/newsevents/speech/kroszner20080204a.htm,American Securitization Forum 2008 Conference,, Las Vegas, Nevada,Randall S. Kroszner,1,1,1,0,0,0,0,0,0,0,0,0,0,0,1,0,0,0,1315-Feb-08,The Federal Reserve's Tools for Responding to Financial Disruptions,"At the Tuck Global Capital Markets Conference, Tuck School of Business, Dartmouth College, Hanover, New Hampshire",http://www.federalreserve.gov/newsevents/speech/mishkin20080215a.htm,Tuck Global Capital Markets Conference,, Tuck School of Business, Dartmouth College,Frederic S. Mishkin,1,1,0,0,0,0,0,0,0,0,1,0,0,0,0,0,0,0,925-Feb-08,Does Stabilizing Inflation Contribute to Stabilizing Economic Activity?,"At East Carolina University's Beta Gamma Sigma Distinguished Lecture Series, Greenville, North Carolina",http://www.federalreserve.gov/newsevents/speech/mishkin20080225a.htm,t Carolina University's Beta Gamma Sigma Distinguished Lecture Series,, Greenville, North Carolina,Frederic S. Mishkin,1,1,0,0,0,0,0,0,0,0,1,0,0,0,0,0,0,0,925-Feb-08,Improving Risk Management in Light of Recent Market Events,"At the Global Association of Risk Management Professionals Annual Risk Convention, New York, New York",http://www.federalreserve.gov/newsevents/speech/kroszner20080225a.htm,Global Association of Risk Management Professionals Annual Risk Convention,, New York, New York,Randall S. Kroszner,1,0,0,0,0,0,0,0,0,0,0,0,0,0,0,0,0,0,26-Feb-08,The U.S. Economy and Monetary Policy,"At the University of North Carolina at Wilmington, Cameron School of Business' Business Week Program, Wilmington, North Carolina",http://www.federalreserve.gov/newsevents/speech/kohn20080226a.htm,University of North Carolina at Wilmington,, Cameron School of Business' Business Week Program, W,Donald L. Kohn,2,1,0,0,0,0,0,0,0,0,1,0,0,0,0,0,0,0,927-Feb-08,The Importance of Economic Education and Financial Literacy,"At the Third National Summit on Economic and Financial Literacy, Washington, D.C.",http://www.federalreserve.gov/newsevents/speech/mishkin20080227a.htm,Third National Summit on Economic and Financial Literacy,, Washington, D.C.,Frederic S. Mishkin,1,1,0,0,0,0,0,0,0,0,0,0,0,0,0,0,1,0,1529-Feb-08,"On ""Leveraged Losses: Lessons from the Mortgage Meltdown""","At the U.S. Monetary Policy Forum, New York, New York",http://www.federalreserve.gov/newsevents/speech/mishkin20080229a.htm,U.S. Monetary Policy Forum,, New York, New York,Frederic S. Mishkin,1,1,1,0,0,0,0,0,0,0,0,0,0,0,0,0,0,0,103-Mar-08,Liquidity-Risk Management in the Business of Banking,"At the Institute of International Bankers Annual Washington Conference, Washington, D.C.",http://www.federalreserve.gov/newsevents/speech/kroszner20080303a.htm,Institute of International Bankers Annual Washington Conference,, Washington, D.C.,Randall S. Kroszner,1,1,1,0,0,0,0,0,0,0,0,0,0,0,0,0,0,0,104-Mar-08,Reducing Preventable Mortgage Foreclosures,"At the Independent Community Bankers of America Annual Convention, Orlando, Florida",http://www.federalreserve.gov/newsevents/speech/bernanke20080304a.htm,Independent Community Bankers of America Annual Convention,, Orlando, Florida,Ben S. Bernanke,3,1,1,0,0,0,0,0,0,0,0,0,0,0,0,0,0,0,104-Mar-08,Outlook and Risks for the U.S. Economy,"At the National Association for Business Economics Washington Policy Conference, Washington, D.C.",http://www.federalreserve.gov/newsevents/speech/mishkin20080304a.htm,National Association for Business Economics Washington Policy Conference,, Washington, D.C.,Frederic S. Mishkin,1,1,0,0,0,0,0,0,0,1,0,0,0,0,0,0,0,0,807-Mar-08,Implications of Globalization for the Conduct of Monetary Policy,"At the International Symposium of the Banque de France, Paris, France",http://www.federalreserve.gov/newsevents/speech/kohn20080307a.htm,International Symposium of the Banque de France,, Paris, France,Donald L. Kohn,2,1,0,0,1,0,0,0,0,0,0,0,0,0,0,0,0,0,307-Mar-08,Exchange Rate Pass-Through and Monetary Policy,"At the Norges Bank Conference on Monetary Policy, Oslo, Norway",http://www.federalreserve.gov/newsevents/speech/mishkin20080307a.htm,Norges Bank Conference on Monetary Policy,, Oslo, Norway,Frederic S. Mishkin,1,1,0,0,1,0,0,0,0,0,0,0,0,0,0,0,0,0,311-Mar-08,The Importance of Fundamentals in Risk Management,"At the American Bankers Association Spring Summit Meeting, Washington, D.C",http://www.federalreserve.gov/newsevents/speech/kroszner20080311a.htm,American Bankers Association Spring Summit Meeting,, Washington, D.C,Randall S. Kroszner,1,1,1,0,0,0,0,0,0,0,0,0,0,0,0,0,0,0,114-Mar-08,Fostering Sustainable Homeownership,"At the National Community Reinvestment Coalition Annual Meeting, Washington, D.C.",http://www.federalreserve.gov/newsevents/speech/bernanke20080314a.htm,National Community Reinvestment Coalition Annual Meeting,, Washington, D.C.,Ben S. Bernanke,3,1,0,0,0,0,1,0,0,0,0,0,0,0,0,0,0,0,527-Mar-08,Protecting Homeowners and Sustaining Homeownership,"At the National Association of Hispanic Real Estate Professionals Legislative Conference 2008, Washington, D.C.",http://www.federalreserve.gov/newsevents/speech/kroszner20080327a.htm,National Association of Hispanic Real Estate Professionals Legislative Conference 2008,, Washingt,,Randall S. Kroszner,1,1,0,1,0,0,0,0,0,0,0,0,0,0,0,0,0,0,227-Mar-08,"Comfort Zones, Shmumfort Zones","At the Sandridge Lecture of the Virginia Association of Economists and the H. Parker Willis Lecture of Washington and Lee University, Lexington, Virginia",http://www.federalreserve.gov/newsevents/speech/mishkin20080327a.htm,Sandridge Lecture of the Virginia Association of Economists and the H. Parker Willis Lecture of,,,,Frederic S. Mishkin,1,1,0,0,0,0,0,0,0,0,1,0,0,0,0,0,0,0,903-Apr-08,Central Bank Commitment and Communication,"At the Princeton University Center for Economic Policy Studies Dinner, New York, New York",http://www.federalreserve.gov/newsevents/speech/mishkin20080403a.htm,Princeton University Center for Economic Policy Studies Dinner,, New York, New York,Frederic S. Mishkin,1,1,0,0,0,0,0,0,0,0,1,0,0,0,0,0,0,0,904-Apr-08,Global Economic and Financial Challenges: Implications for Latin America,"At the Annual Meeting of the Board of Governors of the Inter-American Development Bank, Miami, Florida",http://www.federalreserve.gov/newsevents/speech/kroszner20080404a.htm,Annual Meeting of the Board of Governors of the Inter-American Development Bank,, Miami, Florida,Randall S. Kroszner,1,1,1,0,0,0,0,0,0,0,0,0,0,0,0,0,0,0,107-Apr-08,Dedication remarks,"At the Dedication of the New Seattle Branch Building of the Federal Reserve Bank of San Francisco, Renton, Washington",http://www.federalreserve.gov/newsevents/speech/kohn20080407a.htm,Dedication of the New Seattle Branch Building of the Federal Reserve Bank of San Francisco,, Rent,,Donald L. Kohn,2,1,0,0,1,0,0,0,0,0,0,0,0,0,0,0,0,0,309-Apr-08,The Importance of Financial Education and the National Jump$tart Coalition Survey,"At the Jump$tart Coalition for Personal Financial Literacy and Federal Reserve Board Joint News Conference, Federal Reserve Board, Washington, D.C.",http://www.federalreserve.gov/newsevents/speech/bernanke20080409a.htm,Jump$tart Coalition for Personal Financial Literacy and Federal Reserve Board Joint News Confere,,,,Ben S. Bernanke,3,1,0,0,0,0,0,0,0,0,0,0,0,0,0,0,1,0,1510-Apr-08,Addressing Weaknesses in the Global Financial Markets: The Report of the President's Working Group on Financial Markets,"At the World Affairs Council of Greater Richmond's Virginia Global Ambassador Award Luncheon, Richmond, Virginia",http://www.federalreserve.gov/newsevents/speech/bernanke20080410a.htm,World Affairs Council of Greater Richmond's Virginia Global Ambassador Award Luncheon,, Richmond,,Ben S. Bernanke,3,1,0,1,0,0,0,0,0,0,0,0,0,0,0,0,0,0,214-Apr-08,Financial Market Turmoil and the Federal Reserve: The Plot Thickens,"At the New York University School of Law Global Economic Policy Forum, New York, New York",http://www.federalreserve.gov/newsevents/speech/warsh20080414a.htm,New York University School of Law Global Economic Policy Forum,, New York, New York,Kevin Warsh,1,1,0,0,0,0,0,0,0,0,1,0,0,0,0,0,0,0,917-Apr-08,The Changing Business of Banking: Implications for Financial Stability and Lessons from Recent Market Turmoil,"At the Federal Reserve Bank of Richmond's Credit Market Symposium, Charlotte, North Carolina",http://www.federalreserve.gov/newsevents/speech/kohn20080417a.htm,Federal Reserve Bank of Richmond's Credit Market Symposium,, Charlotte, North Carolina,Donald L. Kohn,2,1,0,0,1,0,0,0,0,0,0,0,0,0,0,0,0,0,321-Apr-08,Developing Sustainable Capital for Community Investments,"At the Community Reinvestment Fund First Annual Forum, Minneapolis, Minnesota",http://www.federalreserve.gov/newsevents/speech/kroszner20080421a.htm,Community Reinvestment Fund First Annual Forum,, Minneapolis, Minnesota,Randall S. Kroszner,1,1,0,0,0,0,1,0,0,0,0,0,0,0,0,0,0,0,505-May-08,Mortgage Delinquencies and Foreclosures,"At the Columbia_Business School's_32nd Annual Dinner, New York, New York",http://www.federalreserve.gov/newsevents/speech/Bernanke20080505a.htm,Columbia_Business School's_32nd Annual Dinner,, New York, New York,Ben S. Bernanke,3,1,0,0,0,0,0,0,0,0,1,0,0,0,0,0,0,0,907-May-08,Mitigating the Impact of Foreclosures on Neighborhoods,"At the NeighborWorks America Symposium on Stabilizing Communities in the Wake of Foreclosure, Cincinnati, Ohio",http://www.federalreserve.gov/newsevents/speech/kroszner20080507a.htm,NeighborWorks America Symposium on Stabilizing Communities in the Wake of Foreclosure,, Cincinnat,,Randall S. Kroszner,1,1,0,0,0,0,1,0,0,0,0,0,0,0,0,0,0,0,513-May-08,Liquidity Provision by the Federal Reserve,"At the Federal Reserve Bank of Atlanta Financial Markets Conference, Sea Island, Georgia (via satellite), Chairman Bernanke presented identical remarks to the Risk Transfer Mechanisms and Financial Stability Workshop, Basel, Switzerland, on May 29, 2008 (via videoconference)",http://www.federalreserve.gov/newsevents/speech/bernanke20080513.htm,Federal Reserve Bank of Atlanta Financial Markets Conference,, Sea Island, Georgia (via satellite,Ben S. Bernanke,3,1,1,0,0,0,0,0,0,0,0,0,0,0,0,0,0,0,114-May-08,Risk Management and Basel II,"At the Federal Reserve Bank of Boston AMA Conference, Boston, MA",http://www.federalreserve.gov/newsevents/speech/kroszner20080514a.htm,Federal Reserve Bank of Boston AMA Conference,, Boston, MA,Randall S. Kroszner,1,1,0,1,0,0,0,0,0,0,0,0,0,0,0,0,0,0,215-May-08,Risk Management in Financial Institutions,"At the Federal Reserve Bank of Chicago's Annual Conference on Bank Structure and Competition, Chicago, Illinois",http://www.federalreserve.gov/newsevents/speech/bernanke20080515a.htm,Federal Reserve Bank of Chicago's Annual Conference on Bank Structure and Competition,, Chicago,,Ben S. Bernanke,3,1,0,0,1,0,0,0,0,0,0,0,0,0,0,0,0,0,315-May-08,How Should We Respond to Asset Price Bubbles?,"At the Wharton Financial Institutions Center and Oliver Wyman Institute's Annual Financial Risk Roundtable, Philadelphia, Pennsylvania",http://www.federalreserve.gov/newsevents/speech/mishkin20080515a.htm,Wharton Financial Institutions Center and Oliver Wyman Institute's Annual Financial Risk Roundta,,,,Frederic S. Mishkin,1,1,0,0,0,0,0,1,0,0,1,0,0,0,0,0,0,0,920-May-08,The Economic Outlook,"At the National Conference on Public Employee Retirement Systems Annual Conference, New Orleans, Louisiana",http://www.federalreserve.gov/newsevents/speech/kohn20080520a.htm,National Conference on Public Employee Retirement Systems Annual Conference,, New Orleans, Louisi,Donald L. Kohn,2,1,0,0,0,0,0,0,0,0,0,0,0,0,1,0,0,0,1321-May-08,The Federal Funds Rate in Extraordinary Times,"At the Exchequer Club Luncheon, Washington, D.C.",http://www.federalreserve.gov/newsevents/speech/warsh20080521a.htm,Exchequer Club Luncheon,, Washington, D.C.,Kevin Warsh,1,1,0,0,0,0,0,0,0,1,0,0,0,0,0,0,0,0,822-May-08,Prospects for Recovery and Repair of Mortgage Markets,"At the Conference of State Bank Supervisors Annual Conference, Amelia Island Plantation, Florida, Governor Kroszner presented identical remarks to the Banco Central do Brasil Annual Seminar on Banking, Financial Stability, and Risk, on May 27, 2008",http://www.federalreserve.gov/newsevents/speech/kroszner20080522a.htm,Conference of State Bank Supervisors Annual Conference,, Amelia Island Plantation, Florida,Randall S. Kroszner,1,1,0,0,1,0,0,0,0,0,0,0,0,0,0,0,0,0,329-May-08,Money Markets and Financial Stability,"At the Federal Reserve Bank of New York and Columbia Business School Conference on the Role of Money Markets, New York, New York",http://www.federalreserve.gov/newsevents/speech/kohn20080529a.htm,Federal Reserve Bank of New York and Columbia Business School Conference on the Role of Money Ma,,,,Donald L. Kohn,2,1,0,0,0,0,0,0,0,1,1,0,0,0,0,0,0,0,929-May-08,Liquidity Provision by the Federal Reserve,"At the Risk Transfer Mechanisms and Financial Stability Workshop, Basel, Switzerland (via videoconference), Chairman Bernanke presented identical remarks to the Federal Reserve Bank of Atlanta Financial Markets Conference, Sea Island, Georgia on May 13, 2008 (via satellite) ",http://www.federalreserve.gov/newsevents/speech/bernanke20080513.htm,Risk Transfer Mechanisms and Financial Stability Workshop,, Basel, Switzerland (via videoconferen,Ben S. Bernanke,3,1,1,0,0,0,0,0,0,0,0,0,0,0,0,0,0,0,103-Jun-08,Remarks on the economic outlook,"At the International Monetary Conference, Barcelona, Spain (via satellite)",http://www.federalreserve.gov/newsevents/speech/bernanke20080603a.htm,International Monetary Conference,, Barcelona, Spain (via satellite),Ben S. Bernanke,3,1,1,0,0,0,0,0,0,0,0,0,0,0,0,0,0,0,104-Jun-08,Remarks on Class Day 2008,"At Harvard University, Cambridge, Massachusetts",http://www.federalreserve.gov/newsevents/speech/bernanke20080604a.htm,vard University,, Cambridge, Massachusetts,Ben S. Bernanke,3,1,0,0,0,0,0,0,0,0,1,0,0,0,0,0,0,0,906-Jun-08,Financial Market Developments and Credit Conditions,"At the Boston College Carroll School of Management Center for Asset Management, Boston, Massachusetts",http://www.federalreserve.gov/newsevents/speech/kroszner20080606a.htm,Boston College Carroll School of Management Center for Asset Management,, Boston, Massachusetts,Randall S. Kroszner,1,1,0,0,0,0,0,0,0,0,1,0,0,0,0,0,0,0,909-Jun-08,Outstanding Issues in the Analysis of Inflation,"At the Federal Reserve Bank of Boston̥s 53rd Annual Economic Conference, Chatham, Massachusetts",http://www.federalreserve.gov/newsevents/speech/bernanke20080609a.htm,Federal Reserve Bank of Boston̥s 53rd Annual Economic Conference,, Chatham, Massachusetts,Ben S. Bernanke,3,1,0,0,0,0,0,0,0,1,0,0,0,0,0,0,0,0,811-Jun-08,Lessons for Central Bankers from a Phillips Curve Framework,"At the Federal Reserve Bank of Boston's 53rd Annual Economic Conference, Chatham, Massachusetts",http://www.federalreserve.gov/newsevents/speech/Kohn20080611a.htm,Federal Reserve Bank of Boston's 53rd Annual Economic Conference,, Chatham, Massachusetts,Donald L. Kohn,2,1,0,0,0,0,0,0,0,1,0,0,0,0,0,0,0,0,811-Jun-08,Protecting Consumers in the Credit Marketplace,"At the Federal Reserve Bank of Cleveland Community Development Policy Summit, Cleveland, Ohio",http://www.federalreserve.gov/newsevents/speech/kroszner20080611a.htm,Federal Reserve Bank of Cleveland Community Development Policy Summit,, Cleveland, Ohio,Randall S. Kroszner,1,1,0,0,0,0,1,0,0,0,0,0,0,0,0,0,0,0,512-Jun-08,Dedication of the New Federal Reserve Bank of Kansas City Building,"At the Federal Reserve Bank of Kansas City, Kansas City, Missouri",http://www.federalreserve.gov/newsevents/speech/bernanke20080612a.htm,Federal Reserve Bank of Kansas City,, Kansas City, Missouri,Ben S. Bernanke,3,1,0,0,1,0,0,0,0,0,0,0,0,0,0,0,0,0,316-Jun-08,Challenges for Health-Care Reform,"At the Senate Finance Committee Health Reform Summit, Washington, D.C. ",http://www.federalreserve.gov/newsevents/speech/bernanke20080616a.htm,Senate Finance Committee Health Reform Summit,, Washington, D.C.,Ben S. Bernanke,3,1,0,0,0,0,0,0,0,0,0,0,0,1,0,0,0,0,1226-Jun-08,Global Economic Integration and Decoupling,"At the International Research Forum on Monetary Policy, Frankfurt, Germany",http://www.federalreserve.gov/newsevents/speech/kohn20080626a.htm,International Research Forum on Monetary Policy,, Frankfurt, Germany,Donald L. Kohn,2,1,0,0,1,0,0,0,0,0,0,0,0,0,0,0,0,0,302-Jul-08,Global Financial Turmoil and the World Economy,"At the Caesarea Forum of the Israel Democracy Institute, Eliat, Israel",http://www.federalreserve.gov/newsevents/speech/mishkin20080702a.htm,Caesarea Forum of the Israel Democracy Institute,, Eliat, Israel,Frederic S. Mishkin,1,1,0,0,0,0,0,0,0,0,0,0,0,1,0,0,0,0,1208-Jul-08,Financial Regulation and Financial Stability,"At the Federal Deposit Insurance Corporation's Forum on Mortgage Lending for Low and Moderate Income Households, Arlington, Virginia",http://www.federalreserve.gov/newsevents/speech/bernanke20080708a.htm,Federal Deposit Insurance Corporation's Forum on Mortgage Lending for Low and Moderate Income Ho,,,,Ben S. Bernanke,3,1,0,0,1,0,0,0,0,0,0,0,0,0,0,0,0,0,317-Jul-08,Federal Reserve's Initiatives to Support Minority-Owned Institutions and Expand Consumer Protection,"Minority Depository Institutions National Conference, Chicago, Illinois",http://www.federalreserve.gov/newsevents/speech/kroszner20080717a.htm,ty Depository Institutions National Conference,, Chicago, Illinois,Randall S. Kroszner,1,1,1,0,0,0,0,0,0,0,0,0,0,0,0,0,0,0,128-Jul-08,Whither Federal Reserve Communications,"At the Peterson Institute for International Economics, Washington, D.C.",http://www.federalreserve.gov/newsevents/speech/mishkin20080728a.htm,Peterson Institute for International Economics,, Washington, D.C.,Frederic S. Mishkin,1,1,0,0,0,0,0,1,0,0,0,0,0,0,0,0,0,0,628-Jul-08,Remarks on covered bond framework,"At the U.S. Department of the Treasury Press Conference on Covered Bond Framework, Washington, D.C.",http://www.federalreserve.gov/newsevents/speech/warsh20080728a.htm,U.S. Department of the Treasury Press Conference on Covered Bond Framework,, Washington, D.C.,Kevin Warsh,1,1,0,0,1,0,0,0,0,0,0,0,0,0,0,0,0,0,322-Aug-08,Reducing Systemic Risk,"At the Federal Reserve Bank of Kansas City's Annual Economic Symposium, Jackson Hole, Wyoming",http://www.federalreserve.gov/newsevents/speech/bernanke20080822a.htm,Federal Reserve Bank of Kansas City's Annual Economic Symposium,, Jackson Hole, Wyoming,Ben S. Bernanke,3,1,0,0,0,0,0,0,0,1,0,0,0,0,0,0,0,0,801-Sep-08,The United States in the International Financial System: A Separate Reality? Resolving Two Puzzles in the International Accounts,"At the Central Bank of Argentina 2008 Money and Banking Conference, Buenos Aires, Argentina",http://www.federalreserve.gov/newsevents/speech/kroszner20080901a.htm,Central Bank of Argentina 2008 Money and Banking Conference,, Buenos Aires, Argentina,Randall S. Kroszner,1,1,0,0,1,0,0,0,0,0,0,0,0,0,0,0,0,0,309-Sep-08,Remarks on historically black colleges and universities,"At the 2008 National Historically Black Colleges and Universities Week Conference, Washington, D.C.",http://www.federalreserve.gov/newsevents/speech/bernanke20080909a.htm,2008 National Historically Black Colleges and Universities Week Conference,, Washington, D.C.,Ben S. Bernanke,3,1,0,0,0,0,0,0,0,0,1,0,0,0,0,0,0,0,911-Sep-08,"Comments on Financial Regulation in a System Context, Beyond Leveraged Losses: The Balance Sheet Effects of the Home Price Downturn, and The Central Role of House Prices in the Financial Crisis: How Will the Market Clear?","At the Brookings Panel on Economic Activity, Washington, D.C.",http://www.federalreserve.gov/newsevents/speech/kohn20080911a.htm,Brookings Panel on Economic Activity,, Washington, D.C.,Donald L. Kohn,2,1,0,0,0,0,0,1,0,0,0,0,0,0,0,0,0,0,607-Oct-08,Current Economic and Financial Conditions,"At the National Association for Business Economics 50th Annual Meeting, Washington, D.C.",http://www.federalreserve.gov/newsevents/speech/bernanke20081007a.htm,National Association for Business Economics 50th Annual Meeting,, Washington, D.C.,Ben S. Bernanke,3,1,0,0,0,0,0,0,0,1,0,0,0,0,0,0,0,0,814-Oct-08,Remarks,"At the President's Working Group Market Stability Initiative Announcement, Washington, D.C.",http://www.federalreserve.gov/newsevents/speech/bernanke20081014a.htm,President's Working Group Market Stability Initiative Announcement,, Washington, D.C.,Ben S. Bernanke,3,1,0,0,0,0,0,0,0,0,0,0,0,1,0,0,0,0,1215-Oct-08,Stabilizing the Financial Markets and the Economy,"At the Economic Club of New York, New York, New York",http://www.federalreserve.gov/newsevents/speech/bernanke20081015a.htm,Economic Club of New York,, New York, New York,Ben S. Bernanke,3,1,0,0,0,0,0,0,0,1,0,0,0,0,0,0,0,0,815-Oct-08,Economic Outlook,"At the Georgetown University Wall Street Alliance, New York, New York",http://www.federalreserve.gov/newsevents/speech/kohn20081015a.htm,Georgetown University Wall Street Alliance,, New York, New York,Donald L. Kohn,2,1,0,0,0,0,0,0,0,0,1,0,0,0,0,0,0,0,9